{
  "contract": "synapsegit.generic-artifact",
  "contract_version": 1,
  "review_id": "0123456789abcdef0123456789abcdef0123456789abcdef0123456789abcdef",
  "state": "pending_review",
  "artifact_manifest_sha256": "3d1e9884c243da349a9f1aab642339caaabd098fe28855c60d34c1d18f3995b6",
  "review_context_sha256": "883724dc6d67e45df58fa26613a6a6ee5ff6778e829b87c9a8a5b9d9511b8b2a",
  "source_attribution": "caller_supplied_ai_attributed",
  "execution_verified": false
}
